Título,Data,Link,Descrição
Anvisa divulga resultado do edital de seleção de dispositivos médicos inovadores,27/02/2024,https://www.gov.br/anvisa/pt-br/assuntos/noticias-anvisa/2024/anvisa-divulga-resultado-do-edital-de-selecao-de-dispositivos-medicos-inovadores-para-projeto-piloto,27/02/2024 - Objetivo do projeto piloto é facilitar o desenvolvimento e a entrada no Brasil de novos produtos.
Seminário sobre dispositivos médicos discutiu papel da Anvisa na inovação,27/02/2024,https://www.gov.br/anvisa/pt-br/assuntos/noticias-anvisa/2024/seminario-sobre-dispositivos-medicos-discutiu-papel-da-anvisa-na-inovacao,27/02/2024 - Encontro anunciou resultado do edital de seleção de dispositivos inovadores.
Confira a edição de fevereiro do Boletim SNVS,26/02/2024,https://www.gov.br/anvisa/pt-br/assuntos/noticias-anvisa/2024/confira-a-edicao-de-fevereiro-do-boletim-snvs,"26/02/2024 - Entre os destaques da publicação, estão as ações para prevenção das doenças causadas por vírus transmitidos por mosquitos, como a dengue."
Anvisa esclarece sobre uso de smartwatch para medição de glicemia,26/02/2024,https://www.gov.br/anvisa/pt-br/assuntos/noticias-anvisa/2024/anvisa-esclarece-sobre-uso-de-smartwatch-para-medicao-de-glicemia,26/02/2024 - Dispositivos não podem ser utilizados para controle glicêmico.
Etiqueta de rastreabilidade de dispositivos médicos é direito do paciente. Saiba mais,23/02/2024,https://www.gov.br/anvisa/pt-br/assuntos/noticias-anvisa/2024/etiqueta-de-rastreabilidade-de-dispositivos-medicos-e-direito-do-paciente-saiba-mais,23/02/2024 - Pacientes devem exigir informações dos produtos utilizados em procedimentos cirúrgicos.
Anvisa divulga classificação do processo seletivo para contratação de estagiários,23/02/2024,https://www.gov.br/anvisa/pt-br/assuntos/noticias-anvisa/2024/anvisa-divulga-classificacao-do-processo-seletivo-para-contratacao-de-estagiarios,"23/02/2024 - Classificação provisória da seleção para estagiários de nível médio, superior e pós-graduação já está disponível para consulta."
Anvisa ingressa no Programa OEA-Integrado,22/02/2024,https://www.gov.br/anvisa/pt-br/assuntos/noticias-anvisa/2024/anvisa-ingressa-no-programa-oea-integrado,"22/02/2024 - Adesão ao programa, aprovada pela Diretoria Colegiada, permitirá o aperfeiçoamento e a qualificação do processo de importação de produtos sujeitos à vigilância sanitária."
Anvisa adere ao Pacto Nacional pela Consciência Vacinal,21/02/2024,https://www.gov.br/anvisa/pt-br/assuntos/noticias-anvisa/2024/anvisa-adere-ao-pacto-nacional-pela-consciencia-vacinal,21/02/2024 - Objetivo é elevar os índices de cobertura vacinal do Plano Nacional de Imunização (PNI).
SCMED realiza workshop sobre Dossiê Informativo de Preços de Medicamentos,21/02/2024,https://www.gov.br/anvisa/pt-br/assuntos/noticias-anvisa/2024/scmed-realiza-workshop-sobre-dossie-informativo-de-precos-de-medicamentos,21/02/2024 - Evento irá abordar aspectos regulatórios e técnicos sobre o processo de elaboração e submissão dos dossiês de preços de medicamentos.
Anvisa e PNUD selecionam dois consultores para atuar na área de Alimentos,19/02/2024,https://www.gov.br/anvisa/pt-br/assuntos/noticias-anvisa/2024/anvisa-e-pnud-selecionam-dois-consultores-para-atuar-na-area-de-alimentos,19/02/2024 - O período para recebimento dos currículos começa nesta segunda-feira (19/2) e termina na sexta-feira (23/2). Participe!
Empresas devem enviar relatório de comercialização de medicamentos,19/02/2024,https://www.gov.br/anvisa/pt-br/assuntos/noticias-anvisa/2024/empresas-devem-enviar-relatorio-de-comercializacao-de-medicamentos,19/02/2024 - Apenas com o envio do relatório as empresas poderão ajustar preços em 2024. Fique atento às datas!
Anvisa apresenta guia de avaliação de neurotoxicidade de agrotóxicos,16/02/2024,https://www.gov.br/anvisa/pt-br/assuntos/noticias-anvisa/2024/anvisa-apresenta-guia-de-avaliacao-de-neurotoxicidade-deagrotoxicos,"16/02/2024 - Encontro virtual será no dia 22/2, às 15h. Participe!"
Disponível gravação do diálogo setorial sobre rotulagem de alimentos com tartrazina,15/02/2024,https://www.gov.br/anvisa/pt-br/assuntos/noticias-anvisa/2024/disponivel-gravacao-do-dialogo-setorial-sobre-rotulagem-de-alimentos-com-tartrazina,15/02/2024 - Encontro virtual aconteceu no dia 24 de janeiro.
Acompanhe a primeira Reunião da Diretoria Colegiada de 2024,15/02/2024,https://www.gov.br/anvisa/pt-br/assuntos/noticias-anvisa/2024/acompanhe-a-primeira-reuniao-da-diretoria-colegiada-de-2024,"15/02/2024 - Encontro será na próxima quarta-feira (21/2), a partir das 9h30, e terá transmissão ao vivo."
Webinar apresenta manual de regularização de protetores solares,14/02/2024,https://www.gov.br/anvisa/pt-br/assuntos/noticias-anvisa/2024/webinar-apresenta-manual-de-regularizacao-de-protetores-solares,"14/02/2024 - Encontro será na próxima segunda-feira (19/2), às 10h."
Anvisa e CECMED celebram memorando de entendimento,09/02/2024,https://www.gov.br/anvisa/pt-br/assuntos/noticias-anvisa/2024/anvisa-e-cecmed-celebram-memorando-de-entendimento,09/02/2024 - O documento é uma atualização do MdE assinado pelas instituições em 2010 e tem como objetivo facilitar o intercâmbio de informações sobre a regulação de produtos médicos.
Quais repelentes posso usar contra o mosquito da dengue?,09/02/2024,https://www.gov.br/anvisa/pt-br/assuntos/noticias-anvisa/2024/quais-repelentes-posso-usar-contra-o-mosquito-da-dengue,09/02/2024 - A Anvisa responde. Leia a matéria para se prevenir com segurança.
Anvisa divulga horário de atendimento ao público no Carnaval,09/02/2024,https://www.gov.br/anvisa/pt-br/assuntos/noticias-anvisa/2024/anvisa-divulga-horario-de-atendimento-ao-publico-no-carnaval,"09/02/2024 - A Central de Atendimento (0800 642 9782) funcionará todos os dias, das 7h30 às 19h30."
Área de Biológicos fará força-tarefa em nova fase do Projeto de Análise Otimizada Online,09/02/2024,https://www.gov.br/anvisa/pt-br/assuntos/noticias-anvisa/2024/area-de-biologicos-fara-forca-tarefa-em-nova-fase-do-projeto-de-analise-otimizada-online,09/02/2024 - Objetivo é reduzir o tempo de fila dos processos. Entenda.
Abram alas para a saúde passar!,09/02/2024,https://www.gov.br/anvisa/pt-br/assuntos/noticias-anvisa/2024/abram-alas-para-a-saude-passar,"09/02/2024 - O Carnaval está aí e, com ele, as dicas da Anvisa para que a festa não termine antes da hora."
"Carnaval: Anvisa alerta sobre uso de cosméticos para modelar, fixar ou trançar os cabelos",09/02/2024,https://www.gov.br/anvisa/pt-br/assuntos/noticias-anvisa/2024/carnaval-anvisa-alerta-sobre-uso-de-cosmeticos-para-modelar-fixar-ou-trancar-os-cabelos,"09/02/2024 - O uso de pomadas irregulares para modelar, trançar ou fixar cabelos pode causar problemas de saúde."
SCMED divulga relação dos grupos econômicos do mercado farmacêutico. Confira!,09/02/2024,https://www.gov.br/anvisa/pt-br/assuntos/noticias-anvisa/2024/scmed-divulga-relacao-dos-grupos-economicos-do-mercado-farmaceutico-confira,09/02/2024 - Portaria publicada também divulga as classes terapêuticas classificadas.
Anvisa publica painel de consulta de pomadas capilares autorizadas,09/02/2024,https://www.gov.br/anvisa/pt-br/assuntos/noticias-anvisa/2024/anvisa-publica-painel-de-consulta-de-pomadas-capilares-autorizadas,09/02/2024 - Agência reforça que apenas as pomadas listadas estão autorizadas para comercialização e uso.
Anvisa cria grupo de trabalho sobre vacinas para arboviroses,09/02/2024,https://www.gov.br/anvisa/pt-br/assuntos/noticias-anvisa/2024/anvisa-cria-grupo-de-trabalho-para-as-vacinas-para-arboviroses,"09/02/2024 - GT irá apresentar recomendações e pareceres quanto ao desenvolvimento não clínico e clínico de vacinas contra chikungunya, dengue e doença pelo zika vírus."
DEFs: fim do prazo da consulta pública,08/02/2024,https://www.gov.br/anvisa/pt-br/assuntos/noticias-anvisa/2024/defs-fim-do-prazo-da-consulta-publica,"08/02/2024 - Prazo para contribuições, que foi de 60 dias, acaba nesta sexta-feira (9/2)."
Anvisa alerta sobre perigos do uso indevido de colas instantâneas em procedimentos de beleza,08/02/2024,https://www.gov.br/anvisa/pt-br/assuntos/noticias-anvisa/2024/anvisa-alerta-sobre-perigos-do-uso-indevido-de-colas-instantaneas-em-procedimentos-de-beleza,08/02/2024 - Agência recebeu relatos de reações alérgicas e irritação ocular associadas ao uso indevido de colas instantâneas para fixar cílios e unhas postiças.
SCMED divulga lista de apresentações de medicamentos que serão inativadas no sistema Sammed,08/02/2024,https://www.gov.br/anvisa/pt-br/assuntos/noticias-anvisa/2024/scmed-divulga-lista-de-apresentacoes-de-medicamentos-que-serao-inativadas-no-sistema-sammed,08/02/2024 - Empresas interessadas deverão encaminhar eventuais pedidos de retificação da lista no prazo de 30 dias.
Anvisa participa da 10ª reunião da Conferência das Partes – COP 10 e da MOP 3,07/02/2024,https://www.gov.br/anvisa/pt-br/assuntos/noticias-anvisa/2024/anvisa-participa-da-10a-reuniao-da-conferencia-das-partes-2013-cop-10,07/02/2024 - Fóruns internacionais discutiram medidas para reduzir o tabagismo.
Anvisa realiza missão em Cuba,07/02/2024,https://www.gov.br/anvisa/pt-br/assuntos/noticias-anvisa/2024/anvisa-realiza-missao-em-cuba,"07/02/2024 - Atividade marca a retomada dos trabalhos do Comitê Gestor Binacional Brasil-Cuba de Ciência, Tecnologia, Inovação e Complexo Econômico-Industrial da Saúde."
Anvisa comunica restabelecimento dos serviços do VigiMed,07/02/2024,https://www.gov.br/anvisa/pt-br/assuntos/noticias-anvisa/2024/anvisa-comunica-o-restabelecimento-dos-servicos-do-vigimed,07/02/2024 - As aplicações e os dados do sistema não foram afetados.
